[
    {
        "id":  "p_001",
        "use_case":  "general_qa",
        "family":  "short_plain",
        "expects_citations":  false,
        "expects_tools":  false,
        "prompt":  "What is the capital of France?"
    },
    {
        "id":  "p_002",
        "use_case":  "code_help",
        "family":  "short_plain",
        "expects_citations":  false,
        "expects_tools":  false,
        "prompt":  "Write a one-liner in JavaScript to fetch the latest data."
    },
    {
        "id":  "p_003",
        "use_case":  "summarization",
        "family":  "short_plain",
        "expects_citations":  false,
        "expects_tools":  false,
        "prompt":  "Summarize the concept of TypeScript in one sentence."
    },
    {
        "id":  "p_004",
        "use_case":  "general_qa",
        "family":  "short_plain",
        "expects_citations":  false,
        "expects_tools":  false,
        "prompt":  "What is the capital of climate policy?"
    },
    {
        "id":  "p_005",
        "use_case":  "code_help",
        "family":  "short_plain",
        "expects_citations":  false,
        "expects_tools":  false,
        "prompt":  "Write a one-liner in JavaScript to look up the record."
    },
    {
        "id":  "p_006",
        "use_case":  "summarization",
        "family":  "short_plain",
        "expects_citations":  false,
        "expects_tools":  false,
        "prompt":  "Summarize the concept of legal contracts in one sentence."
    },
    {
        "id":  "p_007",
        "use_case":  "general_qa",
        "family":  "short_plain",
        "expects_citations":  false,
        "expects_tools":  false,
        "prompt":  "What is the capital of Python?"
    },
    {
        "id":  "p_008",
        "use_case":  "code_help",
        "family":  "short_plain",
        "expects_citations":  false,
        "expects_tools":  false,
        "prompt":  "Write a one-liner in JavaScript to validate the input."
    },
    {
        "id":  "p_009",
        "use_case":  "summarization",
        "family":  "short_plain",
        "expects_citations":  false,
        "expects_tools":  false,
        "prompt":  "Summarize the concept of France in one sentence."
    },
    {
        "id":  "p_010",
        "use_case":  "general_qa",
        "family":  "short_plain",
        "expects_citations":  false,
        "expects_tools":  false,
        "prompt":  "What is the capital of machine learning?"
    },
    {
        "id":  "p_011",
        "use_case":  "code_help",
        "family":  "short_plain",
        "expects_citations":  false,
        "expects_tools":  false,
        "prompt":  "Write a one-liner in JavaScript to compute the result."
    },
    {
        "id":  "p_012",
        "use_case":  "summarization",
        "family":  "short_plain",
        "expects_citations":  false,
        "expects_tools":  false,
        "prompt":  "Summarize the concept of climate policy in one sentence."
    },
    {
        "id":  "p_013",
        "use_case":  "general_qa",
        "family":  "short_plain",
        "expects_citations":  false,
        "expects_tools":  false,
        "prompt":  "What is the capital of REST APIs?"
    },
    {
        "id":  "p_014",
        "use_case":  "code_help",
        "family":  "short_plain",
        "expects_citations":  false,
        "expects_tools":  false,
        "prompt":  "Write a one-liner in JavaScript to format the output."
    },
    {
        "id":  "p_015",
        "use_case":  "summarization",
        "family":  "short_plain",
        "expects_citations":  false,
        "expects_tools":  false,
        "prompt":  "Summarize the concept of Python in one sentence."
    },
    {
        "id":  "p_016",
        "use_case":  "general_qa",
        "family":  "short_plain",
        "expects_citations":  false,
        "expects_tools":  false,
        "prompt":  "What is the capital of healthcare?"
    },
    {
        "id":  "p_017",
        "use_case":  "code_help",
        "family":  "short_plain",
        "expects_citations":  false,
        "expects_tools":  false,
        "prompt":  "Write a one-liner in JavaScript to fetch the latest data."
    },
    {
        "id":  "p_018",
        "use_case":  "summarization",
        "family":  "short_plain",
        "expects_citations":  false,
        "expects_tools":  false,
        "prompt":  "Summarize the concept of machine learning in one sentence."
    },
    {
        "id":  "p_019",
        "use_case":  "general_qa",
        "family":  "short_plain",
        "expects_citations":  false,
        "expects_tools":  false,
        "prompt":  "What is the capital of TypeScript?"
    },
    {
        "id":  "p_020",
        "use_case":  "code_help",
        "family":  "short_plain",
        "expects_citations":  false,
        "expects_tools":  false,
        "prompt":  "Write a one-liner in JavaScript to look up the record."
    },
    {
        "id":  "p_021",
        "use_case":  "summarization",
        "family":  "short_plain",
        "expects_citations":  false,
        "expects_tools":  false,
        "prompt":  "Summarize the concept of REST APIs in one sentence."
    },
    {
        "id":  "p_022",
        "use_case":  "general_qa",
        "family":  "short_plain",
        "expects_citations":  false,
        "expects_tools":  false,
        "prompt":  "What is the capital of legal contracts?"
    },
    {
        "id":  "p_023",
        "use_case":  "code_help",
        "family":  "short_plain",
        "expects_citations":  false,
        "expects_tools":  false,
        "prompt":  "Write a one-liner in JavaScript to validate the input."
    },
    {
        "id":  "p_024",
        "use_case":  "summarization",
        "family":  "short_plain",
        "expects_citations":  false,
        "expects_tools":  false,
        "prompt":  "Summarize the concept of healthcare in one sentence."
    },
    {
        "id":  "p_025",
        "use_case":  "general_qa",
        "family":  "short_plain",
        "expects_citations":  false,
        "expects_tools":  false,
        "prompt":  "What is the capital of France?"
    },
    {
        "id":  "p_026",
        "use_case":  "code_help",
        "family":  "short_tool_heavy",
        "expects_citations":  false,
        "expects_tools":  true,
        "prompt":  "Use the calculator tool to compute the result and return the result."
    },
    {
        "id":  "p_027",
        "use_case":  "general_qa",
        "family":  "short_tool_heavy",
        "expects_citations":  false,
        "expects_tools":  true,
        "prompt":  "Call the search API to fetch the latest data."
    },
    {
        "id":  "p_028",
        "use_case":  "code_help",
        "family":  "short_tool_heavy",
        "expects_citations":  false,
        "expects_tools":  true,
        "prompt":  "Use the database lookup tool to validate the input and return the result."
    },
    {
        "id":  "p_029",
        "use_case":  "general_qa",
        "family":  "short_tool_heavy",
        "expects_citations":  false,
        "expects_tools":  true,
        "prompt":  "Call the weather API to format the output."
    },
    {
        "id":  "p_030",
        "use_case":  "code_help",
        "family":  "short_tool_heavy",
        "expects_citations":  false,
        "expects_tools":  true,
        "prompt":  "Use the code executor tool to look up the record and return the result."
    },
    {
        "id":  "p_031",
        "use_case":  "general_qa",
        "family":  "short_tool_heavy",
        "expects_citations":  false,
        "expects_tools":  true,
        "prompt":  "Call the document parser to compute the result."
    },
    {
        "id":  "p_032",
        "use_case":  "code_help",
        "family":  "short_tool_heavy",
        "expects_citations":  false,
        "expects_tools":  true,
        "prompt":  "Use the translation API tool to fetch the latest data and return the result."
    },
    {
        "id":  "p_033",
        "use_case":  "general_qa",
        "family":  "short_tool_heavy",
        "expects_citations":  false,
        "expects_tools":  true,
        "prompt":  "Call the calendar to validate the input."
    },
    {
        "id":  "p_034",
        "use_case":  "code_help",
        "family":  "short_tool_heavy",
        "expects_citations":  false,
        "expects_tools":  true,
        "prompt":  "Use the calculator tool to format the output and return the result."
    },
    {
        "id":  "p_035",
        "use_case":  "general_qa",
        "family":  "short_tool_heavy",
        "expects_citations":  false,
        "expects_tools":  true,
        "prompt":  "Call the search API to look up the record."
    },
    {
        "id":  "p_036",
        "use_case":  "code_help",
        "family":  "short_tool_heavy",
        "expects_citations":  false,
        "expects_tools":  true,
        "prompt":  "Use the database lookup tool to compute the result and return the result."
    },
    {
        "id":  "p_037",
        "use_case":  "general_qa",
        "family":  "short_tool_heavy",
        "expects_citations":  false,
        "expects_tools":  true,
        "prompt":  "Call the weather API to fetch the latest data."
    },
    {
        "id":  "p_038",
        "use_case":  "code_help",
        "family":  "short_tool_heavy",
        "expects_citations":  false,
        "expects_tools":  true,
        "prompt":  "Use the code executor tool to validate the input and return the result."
    },
    {
        "id":  "p_039",
        "use_case":  "general_qa",
        "family":  "short_tool_heavy",
        "expects_citations":  false,
        "expects_tools":  true,
        "prompt":  "Call the document parser to format the output."
    },
    {
        "id":  "p_040",
        "use_case":  "code_help",
        "family":  "short_tool_heavy",
        "expects_citations":  false,
        "expects_tools":  true,